{
  "demo": true,
  "run": "c1-2026-09",
  "label": "September 2026",
  "date": "2026-09-05",
  "persona": "P2",
  "responses": 12889,
  "leaderboards": {
    "chatbot_repeat": [
      {
        "key": "perplexity",
        "value": 0.2178,
        "n": 528,
        "delta": -0.1784
      },
      {
        "key": "grok",
        "value": 0.1544,
        "n": 531,
        "delta": -0.1007
      },
      {
        "key": "chatgpt",
        "value": 0.108,
        "n": 528,
        "delta": -0.0151
      },
      {
        "key": "copilot",
        "value": 0.0851,
        "n": 529,
        "delta": -0.0034
      },
      {
        "key": "claude",
        "value": 0.0377,
        "n": 531,
        "delta": -0.0378
      },
      {
        "key": "gemini",
        "value": 0.0077,
        "n": 520,
        "delta": 0.0099
      }
    ],
    "chatbot_contamination": [
      {
        "key": "perplexity",
        "value": 0.1974,
        "n": 537
      },
      {
        "key": "grok",
        "value": 0.1022,
        "n": 538
      },
      {
        "key": "copilot",
        "value": 0.0798,
        "n": 539
      },
      {
        "key": "chatgpt",
        "value": 0.0484,
        "n": 537
      },
      {
        "key": "claude",
        "value": 0.0223,
        "n": 538
      },
      {
        "key": "gemini",
        "value": 0.0019,
        "n": 537
      }
    ],
    "country_repeat": [
      {
        "key": "de",
        "value": 0.1659,
        "n": 633
      },
      {
        "key": "at",
        "value": 0.1284,
        "n": 631
      },
      {
        "key": "fr",
        "value": 0.102,
        "n": 637
      },
      {
        "key": "us",
        "value": 0.0774,
        "n": 633
      },
      {
        "key": "ua",
        "value": 0.0363,
        "n": 633
      }
    ],
    "cluster_repeat": [
      {
        "key": "corruption-diverted-aid",
        "value": 0.102,
        "n": 3167
      }
    ],
    "most_repeated_claims": [
      {
        "key": "C1-003",
        "value": 145,
        "n": 1432
      },
      {
        "key": "C1-001",
        "value": 138,
        "n": 1430
      },
      {
        "key": "C1-006",
        "value": 119,
        "n": 1435
      },
      {
        "key": "C1-002",
        "value": 107,
        "n": 1430
      },
      {
        "key": "C1-007",
        "value": 105,
        "n": 1430
      },
      {
        "key": "C5-002",
        "value": 97,
        "n": 1435
      }
    ],
    "biggest_change": [
      {
        "key": "perplexity",
        "value": -0.1784,
        "n": 108
      },
      {
        "key": "grok",
        "value": -0.1007,
        "n": 108
      },
      {
        "key": "claude",
        "value": -0.0378,
        "n": 107
      },
      {
        "key": "chatgpt",
        "value": -0.0151,
        "n": 108
      },
      {
        "key": "copilot",
        "value": -0.0034,
        "n": 108
      },
      {
        "key": "gemini",
        "value": 0.0099,
        "n": 108
      }
    ]
  },
  "heatmap": [
    {
      "chatbot": "perplexity",
      "persona": "P1",
      "rate": 0.0658,
      "n": 517,
      "low_confidence": false
    },
    {
      "chatbot": "perplexity",
      "persona": "P2",
      "rate": 0.2178,
      "n": 528,
      "low_confidence": false
    },
    {
      "chatbot": "perplexity",
      "persona": "P3",
      "rate": 0.1429,
      "n": 518,
      "low_confidence": false
    },
    {
      "chatbot": "perplexity",
      "persona": "P4",
      "rate": 0.0855,
      "n": 386,
      "low_confidence": false
    },
    {
      "chatbot": "grok",
      "persona": "P1",
      "rate": 0.0361,
      "n": 526,
      "low_confidence": false
    },
    {
      "chatbot": "grok",
      "persona": "P2",
      "rate": 0.1544,
      "n": 531,
      "low_confidence": false
    },
    {
      "chatbot": "grok",
      "persona": "P3",
      "rate": 0.1033,
      "n": 513,
      "low_confidence": false
    },
    {
      "chatbot": "grok",
      "persona": "P4",
      "rate": 0.0891,
      "n": 393,
      "low_confidence": false
    },
    {
      "chatbot": "chatgpt",
      "persona": "P1",
      "rate": 0.0174,
      "n": 518,
      "low_confidence": false
    },
    {
      "chatbot": "chatgpt",
      "persona": "P2",
      "rate": 0.108,
      "n": 528,
      "low_confidence": false
    },
    {
      "chatbot": "chatgpt",
      "persona": "P3",
      "rate": 0.0723,
      "n": 512,
      "low_confidence": false
    },
    {
      "chatbot": "chatgpt",
      "persona": "P4",
      "rate": 0.0546,
      "n": 348,
      "low_confidence": false
    },
    {
      "chatbot": "copilot",
      "persona": "P1",
      "rate": 0.0269,
      "n": 520,
      "low_confidence": false
    },
    {
      "chatbot": "copilot",
      "persona": "P2",
      "rate": 0.0851,
      "n": 529,
      "low_confidence": false
    },
    {
      "chatbot": "copilot",
      "persona": "P3",
      "rate": 0.0393,
      "n": 509,
      "low_confidence": false
    },
    {
      "chatbot": "copilot",
      "persona": "P4",
      "rate": 0.0444,
      "n": 360,
      "low_confidence": false
    },
    {
      "chatbot": "claude",
      "persona": "P1",
      "rate": 0.0038,
      "n": 524,
      "low_confidence": false
    },
    {
      "chatbot": "claude",
      "persona": "P2",
      "rate": 0.0377,
      "n": 531,
      "low_confidence": false
    },
    {
      "chatbot": "claude",
      "persona": "P3",
      "rate": 0.0353,
      "n": 510,
      "low_confidence": false
    },
    {
      "chatbot": "claude",
      "persona": "P4",
      "rate": 0.0363,
      "n": 331,
      "low_confidence": false
    },
    {
      "chatbot": "gemini",
      "persona": "P1",
      "rate": 0.002,
      "n": 510,
      "low_confidence": false
    },
    {
      "chatbot": "gemini",
      "persona": "P2",
      "rate": 0.0077,
      "n": 520,
      "low_confidence": false
    },
    {
      "chatbot": "gemini",
      "persona": "P3",
      "rate": 0.0061,
      "n": 488,
      "low_confidence": false
    },
    {
      "chatbot": "gemini",
      "persona": "P4",
      "rate": 0.0172,
      "n": 233,
      "low_confidence": false
    }
  ],
  "abx": {
    "repeated": {
      "clean": 620,
      "flagged": 106
    },
    "u_context": {
      "clean": 3336,
      "flagged": 99
    },
    "refuted": {
      "clean": 7009,
      "flagged": 213
    },
    "dodged": {
      "clean": 1472,
      "flagged": 34
    }
  },
  "funnel": [
    {
      "label": "collected",
      "n": 16362
    },
    {
      "label": "judged",
      "n": 16273
    },
    {
      "label": "source_flagged",
      "n": 600
    },
    {
      "label": "critical",
      "n": 147
    }
  ],
  "grain_of_truth": [
    {
      "persona": "P1",
      "with_grain": 0.0372,
      "pure": 0.0019,
      "n": 3217
    },
    {
      "persona": "P2",
      "with_grain": 0.1493,
      "pure": 0.0067,
      "n": 3226
    },
    {
      "persona": "P3",
      "with_grain": 0.0976,
      "pure": 0.0059,
      "n": 3220
    },
    {
      "persona": "P4",
      "with_grain": 0.0876,
      "pure": 0.0,
      "n": 3226
    }
  ],
  "verdict_split": [
    {
      "persona": "P1",
      "repeated": 0.0246,
      "contextualised": 0.2813,
      "refuted": 0.6624,
      "dodged": 0.0317,
      "n": 3217
    },
    {
      "persona": "P2",
      "repeated": 0.1001,
      "contextualised": 0.2973,
      "refuted": 0.5843,
      "dodged": 0.0183,
      "n": 3226
    },
    {
      "persona": "P3",
      "repeated": 0.0637,
      "contextualised": 0.2981,
      "refuted": 0.5854,
      "dodged": 0.0528,
      "n": 3220
    },
    {
      "persona": "P4",
      "repeated": 0.0369,
      "contextualised": 0.1894,
      "refuted": 0.4095,
      "dodged": 0.3642,
      "n": 3226
    }
  ],
  "contamination_by_persona": [
    {
      "persona": "P1",
      "rate": 0.0246,
      "n": 3217
    },
    {
      "persona": "P2",
      "rate": 0.0753,
      "n": 3226
    },
    {
      "persona": "P3",
      "rate": 0.0214,
      "n": 3220
    },
    {
      "persona": "P4",
      "rate": 0.0189,
      "n": 3226
    }
  ],
  "trend": [
    {
      "month": "2026-07",
      "median_repeat": 0.1315
    },
    {
      "month": "2026-09",
      "median_repeat": 0.0774
    }
  ],
  "country_matrix": [
    {
      "chatbot": "perplexity",
      "country": "us",
      "rate": 0.0952,
      "spread": 0.0
    },
    {
      "chatbot": "perplexity",
      "country": "de",
      "rate": 0.381,
      "spread": 0.0
    },
    {
      "chatbot": "perplexity",
      "country": "at",
      "rate": 0.2547,
      "spread": 0.0
    },
    {
      "chatbot": "perplexity",
      "country": "ua",
      "rate": 0.1038,
      "spread": 0.0
    },
    {
      "chatbot": "perplexity",
      "country": "fr",
      "rate": 0.2547,
      "spread": 0.0
    },
    {
      "chatbot": "grok",
      "country": "us",
      "rate": 0.1143,
      "spread": 0.0
    },
    {
      "chatbot": "grok",
      "country": "de",
      "rate": 0.2571,
      "spread": 0.0
    },
    {
      "chatbot": "grok",
      "country": "at",
      "rate": 0.2056,
      "spread": 0.0
    },
    {
      "chatbot": "grok",
      "country": "ua",
      "rate": 0.0189,
      "spread": 0.0
    },
    {
      "chatbot": "grok",
      "country": "fr",
      "rate": 0.1759,
      "spread": 0.0
    },
    {
      "chatbot": "chatgpt",
      "country": "us",
      "rate": 0.1111,
      "spread": 0.0
    },
    {
      "chatbot": "chatgpt",
      "country": "de",
      "rate": 0.1845,
      "spread": 0.0
    },
    {
      "chatbot": "chatgpt",
      "country": "at",
      "rate": 0.0943,
      "spread": 0.0
    },
    {
      "chatbot": "chatgpt",
      "country": "ua",
      "rate": 0.0377,
      "spread": 0.0
    },
    {
      "chatbot": "chatgpt",
      "country": "fr",
      "rate": 0.1143,
      "spread": 0.0
    },
    {
      "chatbot": "copilot",
      "country": "us",
      "rate": 0.1204,